UserID,Product,Quantity,Date,Category,Price,Palabra_Clave,ProductID
1634,Aceto Balsámico Tipo Modena Cocinero X 250 Cc.,2,2023-05-15,Almacen,$1605,Aceto,1298
1150,Budín Marmolado Best X 170 G.,2,2023-10-23,Almacen,$1750,Budín,206
1301,Medallón Veggies Espinaca Y Quinoa Granja Del Sol X 440 G.,2,2023-04-24,Congelados,$6350,Medallón,1299
1666,Fideos Moño Matarazzo X 500 G.,3,2023-02-11,Almacen,$2350,Fideos,1300
1547,Té Negro En Saquitos Best X 50 Un.,3,2023-09-26,Almacen,$1800,Té,1301
1179,Shampoo Regeneracion Extrema Dove X 200 Cc.,1,2023-02-16,Perfumeria,$1769,Shampoo,1302
1311,Leche En Polvo Etapa 4 Realidad Aumentada Lata Nido X 800 G.,3,2023-05-12,Almacen,$5500,Leche,1303
1593,Crema Tratamiento Elvive Rt5 Keratin 300G,1,2023-04-27,Perfumeria,$5400,Crema,1304
1664,Destapador Pie Llavero Loekemeyer X 1 Un.,3,2023-04-16,Hogar,$2990,Destapador,1305
1692,Pasta Dental Colgate Luminous White Lovers Vino X 70 G,2,2023-10-17,Perfumeria,$3550,Pasta,1306
1490,Trapo Piso Extra Suave Gris 48 Cm X 62 Cm Mr. Trapo X 1 Un.,1,2023-02-02,Limpieza,$2550,Trapo,1307
1266,Yerba Mate Despalada S/ Tacc Rosamonte X 1 Kg.,2,2023-04-04,Almacen,$840,Yerba,1308
1192,Super Acondicionador Dove 1 Minuto - Factor Nutrición 80 X 170 Ml.,2,2023-06-17,Perfumeria,$4850,Super,1276
1289,Rejilla Auto Doble 40 Cm X 50 Cm Mr. Trapo X 1 Un.,2,2023-04-14,Limpieza,$1750,Rejilla,973
1804,Mermelada De Frutilla Sin Azúcares Arcor X 390 G.,1,2023-10-08,Almacen,$640,Mermelada,1309
1464,Aceite De Oliva Extra Virgen Suave La Toscana X 500 Cc.,1,2023-08-27,Almacen,$25600,Aceite,1310
1146,Repuesto Cuadriculado N3 192 Hojas La Anónima X 1 Un.,3,2023-10-22,Hogar,$4645,Repuesto,1311
1736,Salsa De Soja Glaze Teriyaki La Parmesana X 300 Cc.,1,2023-02-17,Almacen,$1015,Salsa,1312
1559,Cera Líquido Plast Y Flotantes Suiza X 850 Cc.,3,2023-01-09,Limpieza,$3995,Cera,1313
1070,Vino Tinto Tempranillo Portillo X 750 Cc.,1,2023-08-15,Vinos-Finos,$3350,Vino,1314
1312,Arvejas Secas Partidas Adenomar X 400 G.,1,2023-07-26,Almacen,$2700,Arvejas,1315
1973,Coloración Grosella Negra T 20 Nutrisse X 1 Un.,2,2023-05-21,Perfumeria,$1300,Coloración,1316
1707,Cerveza No Retornable Bohemian Patagonia X 730 Cc.,3,2023-04-23,Bebidas,$2100,Cerveza,1317
1572,Tartellete Con Mermelada Sabor Frutilla Trio X 300 G.,3,2023-01-27,Almacen,$8150,Tartellete,1318
1320,Jabón Líquido Ropa Diluir Baja Espuma Oxi Botella Skip X 500 Cc.,2,2023-10-18,Limpieza,$6200,Jabón,1319
1276,Coco Rallado Alicante X 50 G.,1,2023-06-14,Almacen,$1900,Coco,1320
1089,Papas Fritas Corte Americano Krach-Itos X 270 G.,1,2023-06-04,Almacen,$870,Papas,762
1198,Arroz Integral Molinos Ala X 1 Kg.,2,2023-09-10,Almacen,$1105,Arroz,1321
1743,Tarro Vertedor Dúo Chico Crom X 1 Un.,1,2023-12-15,Hogar,$2431,Tarro,1322
1694,Papas Fritas Corte Americano Krach-Itos X 270 G.,3,2023-11-03,Almacen,$870,Papas,762
1484,Hinojo (Kg),3,2023-06-28,Frutas-Y-Verduras,$3500,Hinojo,1323
1094,Bombones Surtido De Chocolate Bon O Bon X 272 G.,3,2023-11-08,Almacen,$5600,Bombones,1324
1041,Cepillo Dental 360 Suave Colgate X 2 Un.,1,2023-11-15,Perfumeria,$5652,Cepillo,1281
1564,Barrita Vegana Frutos Rojos Laddu Bar X 30 G.,2,2023-05-23,Almacen,$14205,Barrita,1325
1967,Garbanzos Elio X 400 G.,1,2023-11-02,Almacen,$2665,Garbanzos,1326
1405,Polvo Para Hornear Royal X 50 G.,2,2023-04-18,Almacen,$1275,Polvo,1327
1637,Preservativos Tulipán Texturados X 6 Un.,2,2023-11-28,Perfumeria,$4350,Preservativos,1328
1729,Galletitas Dulces Con Coco Coquitas X 177 G.,2,2023-09-26,Almacen,$2475,Galletitas,1329
1475,Galletitas Dulces Rellenas Melba X 120 G.,3,2023-04-17,Almacen,$1105,Galletitas,1330
1555,Protector Diario Sin Perfume Todos Los Di­As Respirable Carefree X 20 Un.,2,2023-09-03,Perfumeria,$5885,Protector,1331
1007,Gaseosa Sprite Lima Limón Pet X 1 Lt.,3,2023-12-25,Bebidas,$1409,Gaseosa,1332
1425,Oblea Rellena Rhodesia Sabor Chocolate X 22 G.,2,2023-12-26,Almacen,$1250,Oblea,1333
1874,Carpeta N 5 De Dibujo Playstation Mooving,1,2023-12-17,Hogar,$7649,Carpeta,1334
1858,Jugo En Polvo Ananá Verao X 7 G.,3,2023-10-04,Bebidas,$7200,Jugo,1335
1803,Carpeta Boca Big Life,3,2023-03-24,Hogar,$7550,Carpeta,1049
1883,Limón (Kg),2,2023-05-15,Frutas-Y-Verduras,$2950,Limón,1336
1646,Cuchillo Mesa Acero Inoxidable Toronto Simonaggio X 3 Un.,1,2023-05-05,Hogar,$7245,Cuchillo,1337
1193,Aceite Girasol Ecobotella Vitamina D Cocinero X 900 Cc.,3,2023-08-12,Almacen,$1020,Aceite,1338
1072,Carnaza De Paleta Fraccionada/F E/V Best (Kg),2,2023-07-19,Carniceria,$9590,Carnaza,1339
1897,Pañal Adultos Protect Grande Plenitud X 16 Un.,1,2023-02-24,Perfumeria,$2305,Pañal,1340
1220,Jabón  Tocador Botanicals Rosas Francesas Lux X 120 G.,1,2023-04-15,Perfumeria,$8150,Jabón,1341
1314,Yogur Parcialmente Descremada Natural Yogurade X 210 G.,1,2023-02-26,Frescos,$1300,Yogur,1342
1272,Shampoo Rizos Manejable Fructis X 200 Cc.,3,2023-09-08,Perfumeria,$6435,Shampoo,506
1411,Shampoo Fructis Aloe Hidra Bomb X 650 Cc.,1,2023-03-14,Perfumeria,$2660,Shampoo,1343
1658,Talitas Clásicas Hojalmar X 120 G.,2,2023-10-26,Almacen,$1350,Talitas,1344
1882,Chocolate Relleno Frutilla Sapito X 10 G.,2,2023-05-02,Almacen,$1120,Chocolate,1345
1852,Cuaderno Universitario Tapa Forrada Boca Big Pocket X 1 Un.,2,2023-04-16,Hogar,$10450,Cuaderno,341
1029,Galletas Marineras Azucaradas Rianitos X 170 G.,1,2023-04-09,Almacen,$1750,Galletas,1346
1447,Insecticida Aerosol Mmm Fuyi X 360 Cc.,1,2023-01-10,Limpieza,$3960,Insecticida,337
1325,Sopa Crema De Cebolla Con Pimienta Knorr X 65 G.,2,2023-07-20,Almacen,$3800,Sopa,76
1643,Vino Blanco Dulce Marlo X 750 Cc.,2,2023-07-06,Bebidas,$7350,Vino,1347
1120,Vino Tinto Cabernet Sauvignon Casillero Del Diablo X 750 Cc.,1,2023-05-24,Bebidas,$470,Vino,1348
1167,Pastillas De Goma Ositos Mogul X 30 G.,3,2023-01-03,Almacen,$2150,Pastillas,1349
1367,Mix Berries Congelados Karinat X 400 G.,1,2023-08-03,Congelados,$80,Mix,364
1881,Cuaderno Tapa Forrada Comunicaciones 24 Hojas Éxito X 1 Un.,1,2023-10-17,Hogar,$3209,Cuaderno,1111
1507,Antitranspirante Barra Mar Profundo Old Spice X 50 G.,3,2023-02-23,Perfumeria,$5590,Antitranspirante,1350
1489,Copos De Maíz Azucarados Lasfor X 240 G.,2,2023-04-06,Almacen,$2250,Copos,1351
1688,Cucharita Mango Madera Carol X 3 Un.,1,2023-12-12,Hogar,$3205,Cucharita,1352
1882,Lavandina Gel Original Ayudin X 500 Cc.,1,2023-01-15,Limpieza,$5269,Lavandina,1353
1631,Yogur Entero Sabor Dulce De Leche Tregar X 125 G.,1,2023-08-12,Frescos,$900,Yogur,1124
1645,Bolígrafo Surtido Bic X 4 Un.,1,2023-08-23,Hogar,$2100,Bolígrafo,1354
1629,Cepillo Dental Gum Classic 411 Suave X 1 Un.,1,2023-01-16,Perfumeria,$5085,Cepillo,1355
1787,Malta Instantánea El Pocillo X 170 G.,3,2023-04-09,Almacen,$4350,Malta,1356
1828,Escuadra 30X30 Cm La Anónima X 1 Un.,3,2023-08-19,Hogar,$769,Escuadra,493
1092,Vino Tinto Cabernet Franc Las Perdices X 750 Cc.,2,2023-07-08,Bebidas,$1300,Vino,1357
1336,Milanesas Grandes De Soja Fugazzeta X 4 Un. Lucchetti X 560 G.,2,2023-06-18,Congelados,$8650,Milanesas,1358
1639,Plato Postre Vidrio Contempo 19 Cm. Crisa X 1 Un.,1,2023-11-05,Hogar,$600,Plato,1359
1159,Mermelada De Frutilla Orieta Pote X 500 G.,3,2023-06-13,Almacen,$4500,Mermelada,1360
1720,Vino Rosado La Linda X 750 Cc.,1,2023-01-04,Bebidas,$2250,Vino,1361
1787,Limpiador Líquido Procenex Jazmín X 900 Cc.,2,2023-06-11,Limpieza,$2350,Limpiador,1362
1205,Jabon Tocador Humect. Vita Glic Plusbelle X 3 Un. 360 G.,1,2023-09-24,Perfumeria,$5400,Jabon,1363
1183,Queso Untable Vegetal Cheddar La Serenísima X 180 G.,1,2023-12-05,Frescos,$24950,Queso,1364
1657,Cinta Metrica 7.5 Mts. Con Freno Silver Shadow X 1 Un.,2,2023-05-23,Hogar,$449,Cinta,1365
1026,Frutillas Enteras Congeladas Green Life X 400 G.,2,2023-03-21,Congelados,$1722,Frutillas,1366
1249,Arroz Grano Largo Fino 00000 Apóstoles X 1 Kg.,2,2023-07-14,Almacen,$140,Arroz,1367
1169,Cerveza Stella Artois Blanche Lata 473Cc X6,3,2023-09-14,Bebidas,$1267,Cerveza,1368
1865,Alfajor Chocolate Triple Terrabusi X 70 G.,3,2023-05-21,Almacen,$2290,Alfajor,161
1134,Harina Leudante Sin Sodio Pureza X 1 Kg.,3,2023-09-13,Almacen,$714,Harina,1164
1277,Cebolla Verdeo (Kg),3,2023-09-25,Frutas-Y-Verduras,$2749,Cebolla,1369
1008,Papel Higiénico Hoja Simple X 4 Un. 80 M Elegante X 32 M2,3,2023-12-19,Limpieza,$2900,Papel,1370
1364,Limpiador Líquido Aromatizante Poett Flores De Primavera X 1.8 Lts,1,2023-07-04,Limpieza,$1920,Limpiador,1371
1889,Antitranspirante Aerosol Clinical Clã¡Sica Rexona X 150 Cc.,3,2023-11-24,Perfumeria,$5750,Antitranspirante,1372
1472,Café Instántaneo Cappuccino Doy Pack Dolca X 125 G.,2,2023-06-07,Almacen,$7260,Café,1373
1972,Resaltador Flash Verde Pelikan X 1 Un.,3,2023-10-12,Hogar,$1600,Resaltador,1374
1082,Salchichón Con Jamón Feteado Zur Linde X 200 G.,3,2023-02-02,Frescos,$1790,Salchichón,1375
1509,Shampoo Balance Doy Pack Polyana X 300 Cc.,1,2023-09-20,Perfumeria,$6650,Shampoo,1376
1685,Sal Entrefina Parrillera Dos Anclas Estuche X 500 G.,2,2023-10-24,Almacen,$1900,Sal,433
1384,Tapas Para Empanadas Rotiseras Hojaldre Noly X 600 G.,1,2023-08-03,Frescos,$1884,Tapas,1377
1935,Ravioles De Pollo Y Espinaca La Salteña X 450 G.,3,2023-06-04,Frescos,$2300,Ravioles,1378
1737,Cebolla En Escamas La Parmesana X 25 G.,3,2023-08-11,Almacen,$1289,Cebolla,1379
1622,Puré De Papas Knorr X 125 G.,2,2023-06-22,Almacen,$1520,Puré,1380
1394,Esmalte De Uñas Lila Soñado Cutex Nails X 6 Cc.,2,2023-02-19,Perfumeria,$2015,Esmalte,1381
1051,Sopa Clara Campestre Alicante X 68 G.,1,2023-01-04,Almacen,$4245,Sopa,1382
1847,Galletitas Pepas C/Aceite Vegetal Trio X 300 G.,1,2023-06-22,Almacen,$3300,Galletitas,1383
1032,Bolígrafo Azul Faber Castell X 4 Un.,1,2023-10-02,Hogar,$1200,Bolígrafo,1384
1781,Canopla Portalápices Keyroad,1,2023-10-14,Hogar,$6250,Canopla,1385
1947,Cera Depilatoria Vegetal Lata Depilfem X 180 G.,1,2023-04-10,Perfumeria,$2015,Cera,1386
1636,Asadera Vidrio Rectangular 32.4 X 18.6 Cm. Pyr O Rey X 1 Un.,2,2023-12-24,Hogar,$815,Asadera,1387
1401,Pan De Mesa Grande Best X 600 G.,3,2023-02-05,Frescos,$3280,Pan,865
1388,Pila Alcalina Aaa Grundig X 2 Un.,2,2023-02-19,Hogar,$11400,Pila,1388
1860,Shampoo Herbolaria Milenaria Tío Nacho X 200 Cc.,1,2023-08-28,Perfumeria,$60,Shampoo,1389
1575,Obleas Dulces Sinfonía Frutilla Y Crema X 100 G.,3,2023-01-20,Almacen,$809,Obleas,357
1074,Salame Cantimpalo 42 Feteado X 150 G.,1,2023-08-28,Frescos,$2450,Salame,1390
1055,Crema Facial Aclaradora Teatrical X 200 Cc.,2,2023-12-05,Perfumeria,$1700,Crema,1391
1801,"Helado Chocolate/Dulce De Leche/Frutilla Frigor X 1,5 Kg.",3,2023-11-05,Congelados,$14500,Helado,1392
1271,Copos De Maíz Azucarados Bolsa Kids La Anónima X 500 G.,3,2023-04-03,Almacen,$940,Copos,1393
1057,Manteca La Anónima X 500 G.,2,2023-03-14,Frescos,$2100,Manteca,1394
1865,Endulzante Sobres Forte Hileret X 50 Un.,3,2023-02-25,Almacen,$3600,Endulzante,1395
1522,Cera Super Brillo Aerosol Match 1 X 410 Cc.,1,2023-05-25,Hogar,$1240,Cera,1396
1637,Lustramuebles Aerosol Naranja Ceramicol X 360 Cc.,2,2023-04-13,Limpieza,$2500,Lustramuebles,1397
1939,Aceitunas Negras Doy Pack Nucete X 120 G.,3,2023-03-08,Almacen,$929,Aceitunas,406
1079,Papas Fritas Acanaladas Pehuamar X 245 G.,3,2023-10-23,Almacen,$1085,Papas,1398
1135,Jabón Tocador Botan Rosas Fran Lux 3 Un. X 375 G.,1,2023-08-08,Perfumeria,$9100,Jabón,1399
1327,Vino Blanco Chardonnay La Linda X 750 Cc.,1,2023-01-16,Bebidas,$2950,Vino,1400
1051,Té En Saquitos Hierbas Rosa Cachamai X 20 Un.,3,2023-09-23,Almacen,$1050,Té,997
1012,Pasas De Uva Sultanina Rubias El Peoncito X 100 G.,1,2023-11-22,Frutas-Y-Verduras,$2400,Pasas,1401
1970,Te En Saquitos Boldo La Virginia X 25 Un.,2,2023-11-16,Almacen,$4139,Te,1402
1735,Vino Blanco Dulce Dilema X 750 Cc.,3,2023-03-14,Bebidas,$2350,Vino,1403
1493,Galletitas Sin Sal Marineras X 3 Un. Leiva X 330 G.,2,2023-02-15,Almacen,$1500,Galletitas,1404
1863,Cabo Con Rosca Madera La Sampedrina X 1 Un.,3,2023-04-11,Limpieza,$2050,Cabo,1405
1690,Limpiador Multiuso Multimax Cherry X 150 Cc.,1,2023-09-07,Limpieza,$943,Limpiador,1406
1885,Sidra 1888 Rose Cosecha Especial Saenz Briones X 750 Cc.,1,2023-09-21,Bebidas,$20,Sidra,836
1722,Burger Vegetal X 2 Un. Vegetalex X 226 G.,3,2023-02-07,Congelados,$2050,Burger,1407
1300,Cabo De Madero Pino Haragán X 1 Un.,3,2023-07-01,Limpieza,$4909,Cabo,1408
1707,Trapo Piso Extra Suave Blanco 48 X 62 Cm Mr. Trapo X 1 Un.,1,2023-11-25,Limpieza,$5550,Trapo,1409
1546,Pan Blanco Multicereal La Anónima X 540 G.,1,2023-10-18,Frescos,$1550,Pan,812
1586,Jabón Líquido Ropa Diluir Baja Espuma Oxi Botella Skip X 500 Cc.,3,2023-08-10,Limpieza,$6200,Jabón,1319
1877,Cepillo Limpia Vehículos Best X 1 Un.,2,2023-07-09,Limpieza,$3160,Cepillo,1410
1633,Detergente Cif Bioactive Lima 500 Cc.,1,2023-07-14,Limpieza,$1059,Detergente,1411
1990,Endulzante Equalsweet Sobres X 100 Un.,2,2023-03-09,Almacen,$709,Endulzante,917
1930,Carnaza De Paleta Fraccionada/F  E/V Estancias La (Kg),2,2023-07-21,Carniceria,$11040,Carnaza,1412
1236,Vino Nave Robino Blend De Blancas Botella 750Cc X1,2,2023-03-09,Bebidas,$1100,Vino,1413
1587,Café Molido Torrado Equilibrado La Virginia X 250 G.,2,2023-06-17,Almacen,$3550,Café,1414
1473,Galletitas Snacks De Arroz Picantes Gallo Snacks X 100 G.,3,2023-05-27,Almacen,$1700,Galletitas,1415
1872,Shampoo Jengibre Y Ricino Sedal X 190 Cc.,3,2023-09-27,Perfumeria,$42050,Shampoo,1416
1553,Té En Saquitos O Clock Lemon Grass/Jengibre Cachamai X 20 Un.,3,2023-09-09,Almacen,$20,Té,1417
1278,Crema Dental Herbal Blanqueadora Colgate X 90 G.,2,2023-05-19,Perfumeria,$2950,Crema,1418
1377,Rejilla Blanca Best Americana 38X43Cm X 1 Un.,3,2023-11-03,Limpieza,$759,Rejilla,1419
1244,Salsa Pomarola Tradicional Knorr X 340 G.,3,2023-06-01,Almacen,$1910,Salsa,815
1632,Sal Entrefina Paquete Celusal X 500 G.,3,2023-11-15,Almacen,$1450,Sal,166
2000,Set De Mate Con Asa Y Bombilla Marwal X 1 Un.,3,2023-04-13,Hogar,$5950,Set,1214
1238,Detergente Líquido Concentrado Best Limón X 300 Cc.,2,2023-03-16,Limpieza,$1350,Detergente,596
1470,Arroz Doble Carolina Molinos Ala X 1 Kg.,2,2023-06-03,Almacen,$1615,Arroz,1420
1669,Pasta Dental 3D Glamorous White Oral-B X 90 G.,1,2023-01-14,Perfumeria,$3900,Pasta,1421
1136,Queso Untable Balance Crematto Milkaut X 445 G.,2,2023-01-14,Frescos,$3300,Queso,1422
1324,Shampoo Purificación + Jengibre Dove X 300 Cc.,3,2023-02-16,Perfumeria,$6900,Shampoo,340
1128,Flecha Aromatizante Auto Limon Miel Cb X 7 G.,2,2023-07-26,Hogar,$5500,Flecha,1423
1415,Yogur Descremado Bat Frutilla Ilolay X 120 G.,2,2023-03-19,Frescos,$910,Yogur,1424
1442,Americano Marcela X 950 Cc.,2,2023-08-18,Bebidas,$2899,Americano,1425
1458,Arvejas Secas Remojadas La Campagnola X 300 G.,1,2023-04-13,Almacen,$950,Arvejas,1426
1612,Enjuague Bucal Colgate Plax Rojo 500 X 350 Cc,2,2023-10-17,Perfumeria,$5100,Enjuague,1427
1091,Postre En Polvo De Vainilla Godet X 60 G.,1,2023-05-08,Almacen,$6035,Postre,1428
1732,Dulce De Batata A La Vainilla Esnaola X 500 G.,2,2023-08-09,Almacen,$749,Dulce,1429
1256,Fórmula Láctea Lv. Advanced Etapa 1 Sancor X 800 G.,2,2023-08-05,Almacen,$1950,Fórmula,1430
1071,Cepillo Dental Colgate Suave Zig Zag X 2 Un.,3,2023-04-06,Perfumeria,$3700,Cepillo,1431
1260,Shampoo Prov-V Miracles Liso Infinito Pantene X 400 Cc.,3,2023-01-12,Perfumeria,$4150,Shampoo,1432
1639,Queso Rallado La Paulina X 40 G.,2,2023-07-14,Frescos,$9120,Queso,1433
1455,Té En Saquitos Mezcla De Hierbas Best X 25 Un.,1,2023-04-13,Almacen,$2175,Té,1434
1588,Bizcochos De Arroz Dulces Capri X 90 G.,3,2023-12-06,Almacen,$5800,Bizcochos,1435
1648,Tapa De Nalga Envasada Al Vacio Estancias La Anónima (Kg),3,2023-06-24,Carniceria,$11230,Tapa,1436
1418,Bolígrafo Retráctil Negro 1 Mm Filgo X 1 Un.,2,2023-03-12,Hogar,$3850,Bolígrafo,811
1007,Galletitas Con Chips De Chocolate Par-Nor X 120 G.,2,2023-10-12,Almacen,$6100,Galletitas,1437
1488,Vino Tinto Malbec Edición Estiba Finca Natalina X 750 Cc.,1,2023-04-03,Vinos-Finos,$4300,Vino,1438
1258,Miel De Abejas Best Pote X 250 G.,1,2023-11-19,Almacen,$2450,Miel,1439
1672,Shampoo Oleo Nutricion Dove X 200 Cc.,2,2023-10-10,Perfumeria,$2535,Shampoo,1440
1306,Cepillo Dental Suave Pack Kolynos X 2 Un.,1,2023-07-19,Perfumeria,$3100,Cepillo,1441
1280,Pickles En Vinagre Doy Pack Nucete X 120 G.,3,2023-02-26,Almacen,$1439,Pickles,1222
1997,Café Instantáneo Original Nescafé Dolca X 100G.,2,2023-09-19,Almacen,$2450,Café,1442
1426,Pinches Para Catering 15 Cm Party Store X 100 Un.,1,2023-06-11,Hogar,$4835,Pinches,921
1336,Queso Crema Jalapeño La Paulina X 250 G.,3,2023-09-14,Frescos,$2600,Queso,1443
1046,Chupetín Evolución Blueberry Mr.Pops X 432 G.,1,2023-01-25,Almacen,$2625,Chupetín,1444
1554,Crema De Leche Pote Sancor X 360 Cc.,2,2023-02-07,Frescos,$2100,Crema,946
1788,Polvo Para Preparar Brownies Sin Tacc Exquisita X 400 G.,2,2023-05-15,Almacen,$350,Polvo,1445
1472,Vino Espumante Strowberry Federico De Alvear X 750 Cc.,1,2023-08-12,Bebidas,$2535,Vino,1446
1240,Tapas Para Empanadas Criolla El Sol X 12 Un. 320 G.,1,2023-02-07,Frescos,$2500,Tapas,1447
1040,Crema Corporal Firmeza Cicatricure X 400 Cc.,1,2023-12-15,Perfumeria,$8500,Crema,1448
1731,Cepillo De Dientes Colgate Baby (0-12 Meses),2,2023-06-15,Perfumeria,$4650,Cepillo,904
1823,Antitranspirante Original Plusbelle X 150 Cc.,1,2023-07-02,Perfumeria,$1040,Antitranspirante,1449
1936,Yerba Mate C/Palo 4Flex Taragui X 500 G.,2,2023-04-13,Almacen,$3800,Yerba,1450
1533,Queso Provolone Fraccionado La Paulina X 1 Kg.,2,2023-02-13,Frescos,$26250,Queso,1451
1883,Aceite De Oliva Extra Virgen C/Ajo La Toscana X 250 Cc.,1,2023-08-05,Almacen,$1050,Aceite,1452
1421,Toalla Higiénica Normal Con Alas Lina X 8 Un.,3,2023-10-11,Perfumeria,$2950,Toalla,1453
1643,Pan Integral Artesano Bimbo X 500 G.,3,2023-08-12,Frescos,$6280,Pan,1454
1514,Tostadas Multicereal Fitz Roy X 200 G.,3,2023-11-25,Almacen,$1575,Tostadas,1455
1285,Galletitas Chocolate Chocolinas X 250 G.,1,2023-04-02,Almacen,$990,Galletitas,160
1099,Atún En Aceite Best Desmenuzado X 170 G.,2,2023-07-18,Almacen,$4350,Atún,1456
1195,Chocolate Con Maní Nestle X 90 G.,2,2023-12-27,Almacen,$1800,Chocolate,1457
1624,Galletas De Arroz Sabor Oliva & Hierbas Crisppino X 50 G.,2,2023-02-25,Almacen,$2212,Galletas,1458
1396,Salsa Mostaza Y Miel Pampa Gourmet X 300 G.,2,2023-04-27,Almacen,$2039,Salsa,1459
1993,Detergente Líquido Platinum Plus Limón Magistral X 500 Cc.,3,2023-03-13,Limpieza,$3350,Detergente,1460
1097,Cabo Extensible Hasta 2 Mts La Gauchita X 1 Un.,2,2023-10-21,Limpieza,$21150,Cabo,1461
1648,Termo Luminox 1 Lt. Lumilagro X 1 Un.,3,2023-05-05,Hogar,$76550,Termo,660
1913,Saborizador + Bolsa Mostaza Y Miel Alicante X 30 G.,3,2023-05-19,Almacen,$2519,Saborizador,1462
1321,Jabón Líquido Para Manos Mandarina & Romero Palmolive X 221 Cc.,2,2023-05-09,Perfumeria,$880,Jabón,1463
1287,Detergente Polvo Para Maquinas Botella Sun X 1 Kg.,3,2023-02-07,Limpieza,$7400,Detergente,1464
1087,Jugo Concentrado De Limón Minerva X 1 Lt.,2,2023-06-14,Almacen,$1950,Jugo,1465
1724,Salsa Sabor Parmesano Dos Anclas X 350 G.,2,2023-12-18,Almacen,$5625,Salsa,1466
1859,Vino Blanco Sauvignon Blanc Callia X 750 Cc.,3,2023-08-18,Vinos-Finos,$2310,Vino,1467
1250,Medallones De Carne Vacuna Doble Swift X 2 Un. 112 Gr.,1,2023-01-10,Congelados,$4850,Medallones,889
1010,Pan De Salvado Sin Sal Doña Noly X 360 G.,2,2023-06-04,Frescos,$2150,Pan,1468
1195,Coloración Castaño Intenso T3.0 Cor Intensa X 1 Un.,2,2023-04-09,Perfumeria,$4209,Coloración,1469
1557,Jabón Liquido Antibacterial Next Ab X 250 Cc.,3,2023-09-12,Perfumeria,$2100,Jabón,1470
1630,Cartucho Afeitar Fusion Proshield Gillette X 2 Un.,2,2023-02-24,Perfumeria,$2925,Cartucho,1471
1564,Detergente Liquido Ultra Limon Dp Ala X 450 Cc.,3,2023-01-11,Limpieza,$1800,Detergente,1472
1089,Colonia C/Vap. Sophie Mujercitas X 50 Cc.,3,2023-10-15,Perfumeria,$5915,Colonia,1473
1665,Shampoo Pro-V Max Equilibrio Pantene X 700 Cc.,2,2023-08-08,Perfumeria,$3250,Shampoo,1474
1946,Galletitas Crackers La Providencia 303 G.,2,2023-12-20,Desayuno-Y-Merienda,$4785,Galletitas,1475
1286,Leche Modif. En Polvo Desc. Y Deslactozada. Purísima X 400 G.,3,2023-07-25,Almacen,$3975,Leche,1476
1437,Polvo Para Preparar Mousse Ravana Dulce De Leche X 100 G.,1,2023-06-28,Almacen,$3149,Polvo,1477
1090,"Llave Francesa 8"" Fimaco X 1 Un.",2,2023-01-22,Hogar,$35679,Llave,555
1574,Cartucho Afeitar Turbo Gillette X 4 Un.,3,2023-07-27,Perfumeria,$3900,Cartucho,1478
1226,Rollo Cocina Decorados Felpita Disney X 3 Un.,3,2023-12-02,Limpieza,$2025,Rollo,1479
1396,Azúcar Orgánico Ap Sin Tacc Chango X 1 Kg.,3,2023-05-14,Almacen,$1349,Azúcar,1480
1121,Disco Abrasivo 180 X 1.6 Mm. Mota X 1 Un.,2,2023-11-19,Hogar,$2172,Disco,1481
1437,Peine Afro Grande Jean Muir X 1 Un.,1,2023-09-20,Perfumeria,$130,Peine,1482
1961,Aceites Naturales Repuesto Limón Glade X 21 Cc.,1,2023-05-26,Limpieza,$5750,Aceites,1483
1732,Shampoo Prov-V Miracles Liso Infinito Pantene X 200 Cc.,2,2023-03-24,Perfumeria,$2349,Shampoo,540
1401,Vino Blanco Malbec Killka X 750 Cc.,1,2023-07-17,Bebidas,$1650,Vino,1484
1228,Leche En Polvo Entera La Paulina X 800 G.,1,2023-09-18,Almacen,$670,Leche,1485
1977,"Amargo Serrano Tres Torres Pet X 1,5 Lt.",3,2023-10-08,Bebidas,$330,Amargo,1486
1448,Secador Plástico/Goma Haragán N. 40 X 1 Un.,2,2023-05-25,Limpieza,$5400,Secador,1487
1129,Crema Manos Cuidado Intensivo Nivea X 100 Cc.,2,2023-10-23,Perfumeria,$3300,Crema,1488
1220,Aceitunas Verdes Descarozadas La Anónima X 140 G.,2,2023-09-23,Almacen,$1400,Aceitunas,1489
1518,Galletitas Saladix Calabresa X 100 G.,1,2023-10-08,Almacen,$2240,Galletitas,1490
1207,Destornillador Plano 6.5X150 Mm. Mota X 1 Un.,1,2023-07-22,Hogar,$23725,Destornillador,1491
1265,"Aceite De Girasol Pureza X 1,5 Lt.",3,2023-04-11,Almacen,$3800,Aceite,595
1508,Masilla Epoxi 10 Minutos Poxilina X 70 G.,3,2023-06-10,Hogar,$100,Masilla,1492
1683,Mermelada De Naranja Mas Fruta Arcor X 454 G.,2,2023-07-21,Almacen,$900,Mermelada,1294
1493,Leche En Polvo Descremada Est La Serenísima X 400 G.,3,2023-06-14,Almacen,$1750,Leche,1493
1900,Mix De Pimientas C/Molinillo La Anónima X 50 G.,3,2023-09-09,Almacen,$4300,Mix,1494
1437,Chocolate 70% Cacao Bariloche Premium X 100 G.,1,2023-01-10,Almacen,$250,Chocolate,1495
1402,Organizador De Cepillos Redondo Negro Buply X 1 Un.,1,2023-05-09,Limpieza,$1850,Organizador,1496
1639,Harina De Trigo 000 Blancaflor X 1 Kg.,2,2023-06-28,Almacen,$1250,Harina,1254
1378,Chocolate Con Leche Cofler X 140 G.,1,2023-11-28,Almacen,$3900,Chocolate,1497
1691,Acondicionaor Reparacion Intensiva Bagovit Capilar X 350 Cc.,1,2023-05-19,Perfumeria,$6050,Acondicionaor,1498
1920,Crema Para Peinar Hialurónico Sedal X 300 Cc.,1,2023-07-27,Perfumeria,$15650,Crema,1059
1965,Alimento A Base De Azúcar Y Cacao Arcoa X 360 G.,1,2023-10-09,Almacen,$1975,Alimento,502
1363,Carpeta Escolar Simpsons,1,2023-01-17,Hogar,$6385,Carpeta,1499
1349,Almidón De Maíz Sin Tacc Maizena X 500 G.,1,2023-10-17,Almacen,$780,Almidón,1500
1822,Salsa Chimichurri Tahiti X 270 G.,3,2023-03-08,Almacen,$1559,Salsa,1501
1066,Jabón Tocador Skincare Espadol X 240 G.,2,2023-09-06,Perfumeria,$5350,Jabón,1502
1705,Vino Espumante Strowberry Federico De Alvear X 750 Cc.,3,2023-12-09,Bebidas,$2535,Vino,1446
1105,Empanadas Carne Suave X 4 Un. El Noble X 320 Gr.,2,2023-03-10,Congelados,$3395,Empanadas,1503
1798,Chicles Mentol Beldent X 10G.,2,2023-12-15,Almacen,$1680,Chicles,1504
1337,Antitranspirante Aerosol Invisible Woman Rexona X 150 Cc.,3,2023-01-19,Perfumeria,$2950,Antitranspirante,1505
1819,Té En Saquitos Taraguí Boldo X 25 Un.,1,2023-03-06,Almacen,$889,Té,1506
1995,Té En Saquitos Verde Citrus La Virginia X 20 Un.,1,2023-02-28,Almacen,$1917,Té,1507
1750,Mostaza Original Doy Pack Savora X 250 G.,1,2023-03-18,Almacen,$1275,Mostaza,298
1891,Coloración Rubio Ceniza Ultra Brillo Extremo T 7.1 Issue X 1 Un.,2,2023-12-28,Perfumeria,$4100,Coloración,1508
1448,Bolsa Residuos Rollo Verde 45X60 Task X 20 Un.,1,2023-09-07,Limpieza,$5100,Bolsa,1509
1058,Granola Tropical La Anónima X 250 G.,3,2023-07-18,Almacen,$3050,Granola,1510
1145,Caramelo De Goma Tubitos Ext Tutti Mogul X 20 G.,1,2023-11-05,Almacen,$423,Caramelo,1511
1613,Vino Tinto Blend Wine Dispenser Canciller X 3 Lt.,3,2023-09-21,Vinos-Finos,$4699,Vino,1512
1935,Esmalte De Uñas Amor Cutex Nails X 6 Cc.,3,2023-12-23,Perfumeria,$3550,Esmalte,1513
1660,Choclo La Anónima X 300 Gr.,3,2023-07-23,Congelados,$14050,Choclo,1514
1172,Shampoo Engrosador Doy Pack Tã­O Nacho X 400 Cc.,3,2023-09-05,Perfumeria,$4550,Shampoo,1515
1406,Limpiador Liquido Para Pisos Brisa Floral Procenex X 900 Cc.,2,2023-03-24,Limpieza,$960,Limpiador,616
1649,Crema Dental Extra Blanco + Bicarbonato De Sodio Oral-B X 70 G.,2,2023-06-09,Perfumeria,$8365,Crema,1516
1194,Pasta Dental Colgate Sensitive Pro Alivio X 110 G,2,2023-03-04,Perfumeria,$3100,Pasta,1517
1966,Yerba Mate C/Palo Barbacuá La Merced X 500 G.,1,2023-04-07,Almacen,$4500,Yerba,89
1406,Organizador Con Traba 650 Cc. Translúcido Ordene X 1 Un.,1,2023-05-18,Hogar,$4015,Organizador,365
1920,Suplemento Dietario Defensa Simple X 240 G.,1,2023-05-10,Almacen,$4900,Suplemento,1518
1161,Licor De Chocolate Cusenier X 700 Cc.,1,2023-07-28,Bebidas,$37650,Licor,1519
1074,Sopa Crema De Legumbres Alicante X 59 G.,2,2023-12-24,Almacen,$3149,Sopa,1520
1853,Fideos Spaghetti N7 Lucchetti X 500 G.,2,2023-02-14,Almacen,$2650,Fideos,1521
1669,Alicate Mini Punta Chata 4 1/2 Silver Shadow X 1 Un.,3,2023-05-16,Hogar,$7600,Alicate,1522
1649,Capellettis De Pollo Y Espinaca Villa Dagri X 500 G.,1,2023-08-20,Frescos,$2600,Capellettis,1523
1874,Perfume Para Autos Fragancias Surtidas Match 1 X 60 Cc.,2,2023-07-19,Hogar,$2859,Perfume,1524
1245,Pechugas De Pollo La Anónima (Kg),2,2023-11-08,Carniceria,$9764,Pechugas,1525
1340,Toallitas Desinfectantes Ayudín Fresco X 65 Un.,2,2023-11-02,Limpieza,$2100,Toallitas,519
1213,Lava Parabrisa/Anticongelante Revigal X 580 Cc.,2,2023-02-25,Hogar,$4829,Lava,1526
1582,Lavavajillas Aloe Vera Heroe X 750 Cc.,3,2023-09-14,Limpieza,$2450,Lavavajillas,1527
1795,Cerveza Caravana Antares X 473 Cc.,3,2023-07-06,Bebidas,$1690,Cerveza,1528
